{
    "@context": [
        "http://schema.org/test"
    ],
    "id": "test:testResource",
    "itemDescription": "Test Resource Description",
    "refDataModel": "http://example.com/testDatamodel.json",
    "provider": {
        "type": "Relationship",
        "object": "test:relation:ship"
    },
    "location": {
        "type": "GeoProperty",
        "value": {
            "type": "Point",
            "coordinates": [13,17]
        }
    },
    "itemStatus": "active",
    "createdAt": "2018-11-13T20:20:39+00:00"
}

